hr:min:sec 	hr:min:sec 	annotation	layer	index
0:31:50	0:32:10	También quisiera pedirles a los soldados asesinos que piensen lo que van a hacer, que no maten los niños, que reincorporen, que los niños no tienen que ver con los guerrilleros, que antes de cumplir esas órdenes que vean que los que están asesinando.	Entrevista	Rufina_Amaya
0:32:11	0:32:37	Estas han sido las declaraciones de Rufina Amaya Márquez. Mujer campesina, del caserío El Mozote, jurisdicción de Meanguera, víctima y única sobreviviente de la criminal represión desatada por la Junta Militar Democristiana en diciembre 12 de este año en el departamento de Morazán.	Entrevista	Rufina_Amaya
0:32:38	0:33:01	<i>Los quiero ver aquí juzgados <br> en esta plaza, en este sitio. <br> Quiero castigo, <br> quiero castigo, <br> quiero castigo…	Música	Canción
0:33:02	0:33:26	Emplazamos de nuevo al presidente de la Junta Militar Democratacristiana, ingeniero José Napoleón Duarte a que desmienta Radio Venceremos de que toda la población de El Mozote, mujeres, hombres, ancianos y niños fueron masacrados fríamente por las tropas al mando del mayor Cáceres.	Radio Venceremos	
0:33:27	0:33:36	(Música sin letra)	Música	
0:33:37	0:34:00	El pueblo salvadoreño ha dado muestras de una gran heroicidad y de una elevada capacidad combativa. A pesar de las decenas de miles de salvadoreños muertos, continúa y fortalece su lucha libertaria. Hemos vivido muchos ejemplos de coraje y valentía.	Radio Venceremos	
0:34:01	0:34:43	El recién pasado 29 de diciembre, fecha en que los compañeros Elmer, Serapio y Edwin cayeron en los victoriosos combates de la Guacamaya en el departamento de Morazán dando así muestras claras de su agresividad revolucionaria, afianzadas en una indoblegable decisión de vencer y una profunda confianza en la victoria. Ellos nos han legado el ejemplo de revolucionarios, que a pesar de su alta capacidad combativa, nunca perdieron su sencillez y modestia. Son cualidades fundamentales de luchadores proletarios.	Radio Venceremos	
0:34:44	0:35:26	Su consecuencia los llevó a cumplir con su compromiso con el pueblo salvadoreño llegando al máximo compromiso de legar hasta su propia vida. El Frente Oriental Francisco Sánchez ha perdido a tres de sus mejores combatientes, pero estamos seguros que otros ya llenarán el espacio vacío dejado por los compañeros y muchos más seguirán el ejemplo de su decisión de vencer o morir. Unidos para combatir, hasta la victoria final. Revolución o muerte, venceremos. Frente Oriental Francisco Sánchez, zona sur.	Radio Venceremos	
0:35:27	0:35:34	(Música sin letra)	Música	
0:35:35	0:35:47	A continuación, Radio Venceremos, premio 1981 de la Organización Internacional de Periodistas presenta Plomo Informativo.	Radio Venceremos	
0:35:47	0:35:53	(Balacera)	Efectos de sonido	Sonidos
0:35:54	0:35:57	Estas son nuestras informaciones.	Reporte	Reporte
0:35:59	0:36:29	Sacerdote norteamericano acusa a administración Reagan. Los Estados Unidos juegan un papel destructivo en América Latina y países del continente aplicando una peligrosa política semejante a la que les condujo en los años 60 a la guerra de Vietnam, declaró el sacerdote norteamericano Albert Edimen que vivió durante 30 años en El Salvador y Guatemala.	Reporte	EE.UU.
0:36:30	0:37:09	Las fuerzas que se oponen a la dictadura salvadoreña, expresó el sacerdote, crecen día a día y cada vez logran mayores éxitos en su lucha. Volviendo al tema de la injerencia de los Estados Unidos, el sacerdote Reitman afirmó que la ayuda norteamericana a los países del área se circunscribe al suministro de armas y al envío de asesores militares. A la hora en que las fuerzas del Frente Oriental Francisco Sánchez ponen en desbandada a la fuerzas de la dictadura, más información.	Reporte	EE.UU.
0:37:10	0:37:22	Continúa solidaridad para con nuestro pueblo en Venezuela.  Más de 1.500 estudiantes de la universidad venezolana del estado de Zulia condenaron la injerencia de Venezuela y Estados Unidos en nuestro país.	Reporte	Venezuela
0:37:23	0:37:47	En un anuncio publicado en el periódico El Nacional de aquel país los estudiantes universitarios manifestaron su repudio y preocupación por el triste y vergonzoso papel que está jugando en Venezuela al colaborar con la dictadura militar democratacristiana salvadoreña en el genocidio sin precedentes que esta viene realizando desde que usurpó el poder.	Reporte	Venezuela
0:37:48	0:38:26	De nuevo prorrogan estado de sitio. Por 30 días más fue prorrogado el estado de sitio, anunció el pasado martes la Junta Militar Democristiana. El estado de sitio fue implantado en nuestro país el seis de marzo del corriente año, fecha desde la cual le fue suspendida al pueblo salvadoreño las libertades constituciones, especialmente en lo que respecta a la inviolabilidad de la correspondencia libre tránsito por el territorio nacional y el derecho a la libre expresión.	Reporte	
0:38:27	0:38:40	Dentro de breves instantes, Radio Venceremos presentará el mensaje de fin de año de la comandancia general del Frente Farabundo Martí para la Liberación Nacional, vanguardia político-militar de nuestro pueblo.	Reporte	
0:38:41	0:39:23	A continuación, recibimos un informe de guerra del Frente Paracentral Anastasio Aquino que dice así, "29 de diciembre, este día un pelotón del ejército del FMLN colocó emboscadas de aniquilamiento a fuerzas enemigas de la dictadura a las 6:35 AM en el kilómetro 78 de la carretera panamericana en el departamento de San Vicente. A las 10:20 AM el enemigo se hizo presente en un vehículo particular donde se transportaban unos 12 efectivos del ejército vestidos de civil portando todos fusiles G-3."	Reporte	San_Vicente
0:39:24	0:40:02	"Nuestras fuerzas que ya se encontraban apostadas se prepararon para el ataque. El enemigo logró detectarlos y huyeron espantados y gritando, desorganizando la marcha por diferentes rumbos. Este primer ataque fue efectivo, pero cuando el enemigo creyó habernos golpeado se encontró con una emboscada nuestra que se encontraba a unos 150 metros del anterior la cual sorprendió al enemigo disparando ráfagas con fusilería automática a una distancia de 4 metros sobre el objetivo".	Reporte	San_Vicente
0:40:03	0:40:29	"El ataque duró 10 minutos ya que el vehículo detuvo momentáneamente la marcha para luego escaparse de nuestros heroicos combatientes. Nuestros compañeros reportan las bajas de ocho efectivos de la dictadura entre muertos y heridos. Posteriormente, a las 10:35 AM, nuestras fuerzas se retiraron ordenadamente".	Reporte	San_Vicente
0:40:30	0:40:42	Recordamos que Radio Venceremos esta noche a las 10:00 PM transmitirá una misa en homenaje a los héroes y mártires caídos por la revolución salvadoreña.	Reporte	San_Vicente
0:40:43	0:40:56	Y ahora recibimos un parte de guerra del Frente Oriental Francisco Sánchez que refleja las victorias que nuestro pueblo ha alcanzado en las últimas horas en el departamento de Morazán.	Reporte	Morazán
0:40:57	0:41:30	"La comandancia general político y militar del Frente Oriental Francisco Sánchez comunica al pueblo salvadoreño que en la zona norte el día 29 de diciembre en horas de la mañana dio inicio una operación en todo el frente norte que consistió en el ataque simultáneo a las posiciones enemigas ubicadas en Joateca, Cacaopera, Perquín, San Fernando, Torola, El Mozote y la Guacamaya".	Enfrentamiento	Morazán
0:41:31	0:42:09	"Este mismo día en horas de la tarde nuestras fuerzas tomaron las posiciones de la Guacamaya y El Mozote. En la Guacamaya se desorganizó a las fuerzas enemigas, se capturó material de guerra y se hicieron prisioneros. Asimismo, para las 12:00 PM nuestras fuerzas habían logrado cercar regular cantidad de enemigos y al puesto de mando. El día 30 de diciembre a primeras horas de la mañana nuestras fuerzas lograron reducir al puesto de mando".	Prisioneros	Morazán
0:42:10	0:42:49	"En esa posición murieron el teniente José León Delgado Escobar, el cabo de apellido Cubías y otro cabo cuyo nombre aún no poseemos. Para las horas de la tarde nuestras fuerzas iniciaron el avance contra las posiciones enemigas en Arambala. Entrando las primeras horas de la noche habíamos arrebatado todas las posiciones de dicha población de Arambala. El enemigo salió en desbandada y completamente desorganizado".	Bajas	Morazán
0:42:50	0:43:47	"El material recuperado es el siguiente, 17 fusiles G3, un cañón 90 milímetros, cinco proyectiles del cañón 90 milímetros, un M79, siete granadas de M79, granadas de fusil G3, cascos de acero, mochilas, capas, cobijas, alimentos, etcétera, munición calibre 7.62, dos cananas de ametralladora, dos radios de comunicación militar, una pistola nueve milímetros. Además de esto, resultaron dos helicópteros averiados".	Armamento	Morazán
0:43:49	0:44:19	"Bajas enemigas. Los muertos en la Guacamaya y El Mozote son 18, sin incluir las bajas en Arambala. Heridos de la dictadura en una lista incompleta aún, 21 soldados, capturados son cinco. Eran siete, pero dos capturados que estaban gravemente heridos fallecieron".	Bajas	Morazán
0:44:20	0:44:50	"En los ataques a Cacaopera, San Fernando, Perquín, Torola y Joateca se hicieron siete bajas, sin incluir las de Cacaopera por no conocer el resultado. En emboscadas a los refuerzos de Gotera se le causaron 13 bajas a la dictadura. Total de bajas 64, entre ellas un teniente y dos cabos".	Bajas	Morazán
0:44:51	0:45:23	"Los capturados son los siguientes. Subsargento enfermero Manuel Antonio Rosales, 25 años. Soldado Herber Francisco Lemus Castillo, 18 años. Soldado Gilberto Morales Barrera, 18 años. Soldado Nelson Ernesto Orellana, 25 años. Soldado Alberto Martínez Villalta, 15 años".	Prisioneros	Morazán
0:45:24	0:45:45	"Bajas por parte nuestra. Murieron los compañeros jefes de escuadra Elmer y Serapio y el segundo jefe de escuadra y ametralladorista Edwin. Resultó herido el compañero Gilberto de la sección de comandos y francotiradores".	Bajas	Morazán
0:45:46	0:46:24	"Al mismo tiempo que damos este comunicado al pueblo salvadoreño, hacemos un llamado a la Cruz Roja Internacional, a los familiares de los soldados y de los clases, así como del oficial caído para que recojan los cadáveres de sus familiares, estos se encuentran enterrados en el volcancillo de Joateca. También pueden ser entregados a la misma Fuerza Armada por intermedio de la Cruz Roja Internacional".	Reporte	Cruz_Roja
0:46:25	0:46:43	"En cuanto a los capturados también hacemos un llamado a la Cruz Roja Internacional para que se haga cargo de ellos y que constate que se encuentran en buenas condiciones y que han recibido buenos tratos."	Prisioneros	Cruz_Roja
0:46:44	0:47:11	"Este mismo día nuestras fuerzas del Frente Oriental en el sur incursionan nuevamente en las ciudades de San Miguel y Usulután a partir de las 8:30 PM, sosteniéndose dentro de estas ciudades fuertes combates sin tener hasta el momento todos los datos precisos".	Enfrentamiento	Morazán